{
  "$schema": "https://json-schema.org/draft/2020-12/schema",
  "$id": "https://raw.githubusercontent.com/conuti-gmbh/bo4e-schema/master/schemas/v1/bo/Sperraufrag.schema.json",
  "title": "Sperrauftrag",
  "type": "object",
  "properties": {
    "boTyp": {
      "$ref": "../enum/BOTyp.schema.json",
      "default": "SPERRAUFTRAG"
    },
    "versionStruktur": {
      "type": "string",
      "default": "1"
    },
    "treffpunkt": {
      "$ref": "../com/Adresse.schema.json"
    },
    "sperrauftragsart": {
      "$ref": "../enum/Sperrauftragsart.schema.json"
    },
    "sperrauftragsstatus": {
      "$ref": "../enum/Auftragsstatus.schema.json"
    },
    "sperrauftragsablehngrund": {
      "$ref": "../enum/Sperrauftragsablehngrund.schema.json"
    },
    "sperrauftragsverhinderungsgrund": {
      "$ref": "../enum/Sperrauftragsverhinderungsgrund.schema.json"
    },
    "zaehlernummer": {
      "type": "string",
      "faker": {
        "string.binary": {
          "prefix": "ZAEHLER_",
          "length": 6
        }
      }
    },
    "istVomGerichtsvollzieherAngeordnet": {
      "type": "boolean"
    }
  },
  "required": [
    "boTyp",
    "versionStruktur"
  ]
}
