{
  "boTyp": "SPERRAUFTRAG",
  "versionStruktur": "1",
  "treffpunkt": {
    "postleitzahl": "64677",
    "ort": "Neu Kira",
    "strasse": "Regensburger Str.",
    "hausnummer": "3",
    "postfach": "qui exercitation laboris",
    "adresszusatz": "sunt ex",
    "coErgaenzung": "ipsum cillum sed",
    "landescode": "VU",
    "ortsteil": "Wilhelmshaven",
    "zusatzInformation": {
      "zusatz1": "voluptate incididunt pariatur non do",
      "zusatz2": "sunt dolore",
      "zusatz3": "deserunt sed",
      "zusatz4": "sed nisi",
      "zusatz5": "ut nulla veniam"
    }
  },
  "sperrauftragsart": "ENTSPERREN",
  "sperrauftragsstatus": "ZUGESTIMMT",
  "sperrauftragsablehngrund": "ANDERER_FEHLER",
  "sperrauftragsverhinderungsgrund": "TECHNISCHER_VERHINDERUNGSGRUND",
  "zaehlernummer": "ZAEHLER_111011",
  "istVomGerichtsvollzieherAngeordnet": false
}