{
  "boTyp": "SPERRAUFTRAG",
  "versionStruktur": "1",
  "treffpunkt": {
    "postleitzahl": "76019",
    "ort": "Jenniferland",
    "strasse": "Burgweg",
    "hausnummer": "67",
    "postfach": "cillum reprehenderit esse ut ipsum",
    "adresszusatz": "mollit laborum",
    "coErgaenzung": "reprehenderit sit ut quis nisi",
    "landescode": "PL",
    "ortsteil": "Hattingen",
    "zusatzInformation": {
      "zusatz1": "occaecat ut",
      "zusatz2": "velit irure sit sunt",
      "zusatz3": "nulla",
      "zusatz4": "laborum ea velit officia amet",
      "zusatz5": "fugiat et in sed"
    }
  },
  "sperrauftragsart": "SPERREN",
  "sperrauftragsstatus": "UMGESETZT",
  "sperrauftragsablehngrund": "FALSCHE_SPANNUNGSEBENE",
  "sperrauftragsverhinderungsgrund": "TECHNISCHER_VERHINDERUNGSGRUND",
  "zaehlernummer": "ZAEHLER_000100",
  "istVomGerichtsvollzieherAngeordnet": true
}